{
  "schemaVersion": 1,
  "seed": 10,
  "deviation": 0,
  "narrativeBrief": "Deviation 0. Do not add incidents.",
  "draft": {
    "schemaVersion": 1,
    "cast": [
      { "id": "sitter", "query": "<firstname male>" }
    ],
    "beats": [
      "<::sitter> sat by the window.",
      "The light went.",
      "He folded a cloth.",
      "He put it away."
    ]
  }
}
